"Title","Text"
"Options running out as Najaf talks collapse","BAGHDAD -- After more than a week of fighting between the Mahdi Army and the combined US and Iraqi forces in Najaf, Baghdad's Sadr City, and a half-dozen other cities, analysts say neither interim Prime Minister Iyad Allawi nor radical cleric Moqtada al-Sadr had any good options left other than to talk."
"ATHENS 2004/Inoue crashes out","ATHENS-In one of the biggest shocks in Olympic judo history, defending champion Kosei Inoue was defeated by Dutchman Elco van der Geest in the men #39;s 100-kilogram category Thursday. "
"Houllier praises Rafa #39;s new Liverpool","Gerard Houllier was angry to read reports about his criticism of Rafael Benitez in the Sunday papers, and insists he believes the Spaniard is doing well at Anfield."
"England soon lose opener Strauss","LONDON, England (Reuters) -- England lost opener Andrew Strauss as they reached 53 for one at lunch on the first day of the fourth and final test against West Indies at The Oval. "
"Dutch Clear Van Gogh Slay Suspects (AP)","AP - Six men arrested following the slaying of filmmaker Theo van Gogh are no longer suspects in the killing, but still face charges for belonging to a terrorist group, authorities said Tuesday."
"Judges rule file-sharing software legal","update A federal appeals court has upheld a controversial court decision that said file-sharing software programs such as Grokster or Morpheus are legal. "
"QBs Grab Spotlight","Chris Simms, the Buccaneers second-year pro competing for Tampa Bay's No. 2 job, completed 12 of 15 passes for 110 yards to help the Bucs to a 20-6 victory over the Cincinnati Bengals on Monday."
"S.Koreans Clash with Police on Iraq Troop Dispatch (Reuters)","Reuters - South Korean police used water cannon in\central Seoul Sunday to disperse at least 7,000 protesters\urging the government to reverse a controversial decision to\send more troops to Iraq."
"Japan Court: Bobby Fischer Can Be Deported","TOKYO (Reuters) - A Tokyo court on Friday rejected a request by former world chess champion Bobby Fischer to have the Japanese authorities halt procedures to deport him, his lawyer said. "
"AOL releases Netscape update","Netscape Communications upgraded its namesake browser on Tuesday to version 7.2, a rare sign of life at America Online #39;s moribund browser division. "
"Ceradyne shares surge on Army contract award","NEW YORK, Aug 20 (Reuters) - Shares of Ceradyne Inc. (CRDN.O: Quote, Profile, Research) , a maker of ceramic body armor, surged to an all-time high on Friday on news that the company has won a US Army contract worth up to \$461 million. "
"Greek runners are suspended","ATHENS -- Star sprinters Kostas Kenteris and Katerina Thanou were suspended yesterday from the Greek Olympic team for missing drug tests, but their fate was left in the hands of the International Olympic Committee."
"GOP Rep. Cubin Wins Wyoming Primary (AP)","AP - U.S. Rep. Barbara Cubin fended off four Republican challengers in Tuesday's primary election, securing a shot at a sixth term in this fall's general election."
"Week Ahead: Stocks May Rally if Oil Eases (Reuters)","Reuters - Investors will watch for oil news from\Russia and Iraq next week, but skepticism that crude prices can\stay sky-high is growing and a break in the energy market would\fuel a rally in U.S. stock markets."
"Feedster Includes Kanoodle Ads in RSS Feeds","Feedster Includes Kanoodle Ads in RSS Feeds\\Feedster, Inc. today announced the launch of its RSS feed media program. The Company rsquo;s RSS search feeds will soon contain context targeted ads from Kanoodle, Inc., a leading provider of sponsored links for search results and content pages. Alternatively searchers may opt to pay ..."
"Crushing the Little Guys (Forbes.com)","Forbes.com - In 1999 a wave of novice broadcasters tried to start several thousand new ""low-power"" FM radio stations, fledgling outfits that would fill gaps in the FM radio band. One group sought a license to air Baptist homilies in Connecticut, another for jazz in Oklahoma, another for Vietnamese talk shows in Minnesota."
"Conference Gives Iraq Democracy First Test (AP)","AP - Despite the steady clang of mortar shells outside and persistent violence in the country, many delegates at the opening on Sunday of Iraq's National Conference held out hope that this first fragile taste of democracy would succeed."
"Olympics-Federer #39;s Olympic dream shattered twice over","ATHENS, Aug 17 (Reuters) - World number one Roger Federer #39;s top target for the year -- an Olympic tennis gold medal -- was taken away from him in a  quot;terrible day quot; on Tuesday. "
"IBM Nabs \$750M Deal with Lloyds TSB","Lloyds TSB has tapped IBM as the key provider for its massive new VoIP infrastructure project. The new project will make Lloyds TSB the owners of one of the largest converged voice and data networks in Europe "
"Blast at Police Post in Nassiriya, Three Dead"," NASSIRIYA, Iraq (Reuters) - A blast ripped through a police  station in the town of Nassiriya in southern Iraq on Friday,  killing three police and wounding others, police said."
"Olympics-Henin rust-free but Ferrero falters","ATHENS, Aug 17 (Reuters) - Any hint of rust after a 12-week lay-off was long gone by the time Justine Henin-Hardenne took to the Olympic tennis court on Tuesday, a fact drummed mercilessly home to Venezuela #39;s Maria Vento-Kabchi. "
"Bush hasn #39;t decided on tax reform-Treasury #39;s Snow","WASHINGTON, Aug 20 (Reuters) - President George W. Bush has not decided on whether wholesale changes to the US tax code would be a focus of administration policy if he won a second term, US Treasury Secretary John Snow said on Friday. "
"What Next for Venezuela?","President Hugo Chavez is riding high after his overwhelming victory in a recall vote this week, but analysts say his triumph may have limited impact on the deep economic and political problems threatening this major oil-producing country."
"Will Schwab Reward Patience?","The company saw an improvement in its trades, but will this market be kind to the brokerages?"
"Argentina rejects IMF intervention","In the face of sharp disagreements between Argentina and the International Monetary Fund (IMF), on August 8 the Argentine government decided to temporarily suspend negotiations with ..."
"Outgoing Ambassador Of Qatar Meets Musharraf","ISLAMABAD, Pakistan : Aug 18 (PID) - The outgoing Ambassador of Qatar, Mr. Abdullah Falah A. Al-Dosari paid a courtesy called on the President General Pervez Musharraf here on Tuesday. "
"Suspected Militants Kidnap Iraqi Officer-Jazeera"," DUBAI (Reuters) - Suspected militants have kidnapped an  Iraqi intelligence officer in response to the fighting in the  holy city of Najaf, Al Jazeera television reported on Tuesday."
"Limited Quarterly Earnings Climb"," NEW YORK (Reuters) - Clothing retailer Limited Brands Inc.  &lt;A HREF=""http://www.investor.reuters.com/FullQuote.aspx?ticker=LTD.N target=/stocks/quickinfo/fullquote""&gt;LTD.N&lt;/A&gt; on Thursday posted sharply higher quarterly earnings on  gains from the sale of its stake in Galyans Trading Co. and  strong customer response to sales events early in the quarter."
"Manning Does His Part to Start a Controversy","HARLOTTE, Aug. 19 - Eli Manning was handed his first chance to prove he could be a starting quarterback in the NFL Thursday night against the Carolina Panthers. If Manning #39;s performance was any indication, the Kurt Warner era with the ..."
"Dutch Firm Beats Apple to Punch","A music retailer from the Netherlands beats Apple by launching a download service in Europe's latest market battleground. Also: Movie industry wrests agreement from defunct company.... Microsoft challenges Photoshop   hellip;. and more."
"Why Tech Stocks Stink (Forbes.com)","Forbes.com - The wit who dubbed August ""the dog days of summer"" could have been looking at 2004's tech stocks in his crystal ball. Just what is ailing these critters? Let's look at all of the possible explanations. Perhaps by eliminating the foolish and transient we can discover a theme and pick up some bargains."
"Yao #39;s 39 carries China past New Zealand","ATHENS, Greece - Yao Ming bounced back from a rough opening game with 39 points and 13 rebounds to lead China to a 69-62 victory over New Zealand in the men #39;s basketball Group A tournament Tuesday. "
"Ford Shelves Oracle-Based Procurement System","After nearly five years of development work, Ford Motor Co. will dismantle an Oracle-based procurement application and shift back to earlier technology, a company spokesman confirmed Thursday. "
"Pettitte out for the season","PHILADELPHIA -- Andy Pettitte #39;s first year as a non-Yankee ended yesterday in appropriately depressing fashion: His team was here at Citizens Bank Park, and he was back home in Houston, preparing for season-ending surgery. "
"United Warns It May Jettison Pension Plans to Stay Afloat","United Airlines said the termination of its four employee pension plans was needed to attract the financing that would allow it to emerge from bankruptcy protection."
"US Supreme Court hears dispute over interstate wine sales; Maine &lt;b&gt;...&lt;/b&gt;","The Supreme Court is considering whether states may bar people from buying wine directly from out-of-state suppliers, a big-money question that could lead to sweeping changes "
"Iraq Cleric Agrees to End Uprising, Fighting Rages On"," NAJAF, Iraq (Reuters) - A radical Iraqi cleric leading a  Shi'ite uprising agreed on Wednesday to disarm his militia and  leave one of the country's holiest Islamic shrines after  warnings of an onslaught by government forces."
"A bit of a head-scratcher","In many professional leagues recently, the defending champion has had a smooth start to the season. Mexico proved to be an exception, though, as UNAM Pumas fell to Tecos, 1-0, losing two players and coach Hugo Sanchez to ejections Sunday."
"Unions  #39;close to BA deal #39;","Union negotiators today claimed they were close to agreeing a pay deal with British Airways to avoid a bank holiday strike and the resulting travel chaos. "
"Expedition to Probe Gulf of Mexico (AP)","AP - Scientists will use advanced technology never before deployed beneath the sea as they try to discover new creatures, behaviors and phenomena in a 10-day expedition to the Gulf of Mexico's deepest reaches."
"Oracle readies CRM updates","Oracle Corp. plans to release the latest version of its CRM (customer relationship management) applications within the next two months, as part of an ongoing update of its E-Business Suite."
"Columnists: Infected In Twenty Minutes","What normally happens within twenty minutes? That's how long your average unprotected PC running Windows XP, fresh out of the box, will last once it's connected to the Internet."
"Microsoft Releases New 64-Bit Windows Preview (NewsFactor)","NewsFactor - Microsoft (Nasdaq: MSFT) is offering the latest iteration of its 64-bit computing\platform, announcing the release of beta software for PCs and servers.\The release marks the next step in the software giant's efforts to\address the needs of high-end customers."
"News: U.S. tackles Emergency Alert System insecurity","The FCC acknowledges that the government-mandated network that lets officials interrupt radio and television broadcasts in an emergency  is vulnerable to electronic tampering.\"
"Nortel to lay off 3,500","The scandal-beset company will also lay off about 10 percent of its work force."
"Nortel #39;s new chief gets down to business","William Owens, the new chief executive of Nortel Networks Corp., is putting his personal stamp on the organization. "
"SEC seeks to update stock sale rules","BEIJING, Aug.18 (Xinhuanet) -- The US Securities and Exchange Commission (SEC) may revise its rules on initial stock offerings to modernize 1930s-era guidelines, agency commissioners and staff said. "
"A Digital Doctor Treats Computer Contamination","Unfortunately for users, computer equipment manufacturers and resellers don't adequately inform Windows users of the risks involved in accessing the Internet without proper security measures.&lt;br&gt;&lt;FONT face=""verdana,MS Sans Serif,arial,helvetica"" size=""-2""\ color=""#666666""&gt;&lt;B&gt;-The Washington Post&lt;/b&gt;&lt;/font&gt;"
"Infocus: Wireless Attacks and Penetration Testing (part 3 of 3)","This third and final part of the wireless pen-test series looks at how to mitigate the security risks outlined in the previous articles, and then looks at some proposed solutions currently in front of the IETF."
"Greek Drugs Embarrassment Overshadows Phelps"," ATHENS (Reuters) - Greece was rocked by the threat of being  stripped of an Athens Games medal and the host nation's team  manager offered to quit on Friday, as doping overshadowed  Michael Phelps' drive to be Olympic swimming's top medal  winner."
"A wary sense of relief in Athens","ATHENS At the end of the first week of the Olympic Games, security officials are generally pleased, even surprised, by the calm so far, though they caution that a safe opening ceremony and first week may encourage a laxness that could yet give terrorists "
"Armadillo Aerospaces X Prize Prototype Crashes (SPACE.com)","SPACE.com - Armadillo Aerospace of Mesquite, Texas has reported a \crash last weekend of their prototype X Prize rocket."
"Tributes paid to Belgium #39;s  #39;magic #39; football coach","The Belgian press paid tribute to Raymond Goethals on Tuesday, describing him as the magician and looking back on his teams many victories."
"US Airways Asks Pilots for Pay Cut"," WASHINGTON (Reuters) - US Airways &lt;A HREF=""http://www.investor.reuters.com/FullQuote.aspx?ticker=UAIR.O target=/stocks/quickinfo/fullquote""&gt;UAIR.O&lt;/A&gt;, struggling to  avoid a second bankruptcy, has asked pilots for a 16.5 percent  pay cut, USA Today reported in its Friday editions."
"Update 1: Vivendi, Messier Are Fined \$1.35 Million","Vivendi Universal and its former chief Jean-Marie Messier have each been fined 1 million euros (\$1.35 million) for misleading financial information issued by the company when Messier was in charge, Messier #39;s lawyer said Tuesday."
"Clinton: Ex-President Inaugurates China-Backed Internet Search &lt;b&gt;...&lt;/b&gt;","Former President Bill Clinton helped launch a new Internet search firm that claims better results for its engine than Google (nasdaq: GOOG - news - people ). The firm is called Accoona, from the Swahili phrase "
"Eye on Athens, China stresses a 'frugal' 2008 Olympics","Amid a reevaluation, officials this week pushed the completion date for venues back to 2007."
"A Throwback to Olympia","ATHENS -- Today, Olympians will be in the ancient stadium at Olympia for the shot put competition. Been there, but haven #39;t done that. "
"FCC certifies Freescale ultrawideband technology","Freescale Semiconductor starts shipping its XS110 chip, which will help consumers to connect devices wirelessly."
"US Economy Recovery slows, leading indicators drop","NEW YORK (AP) - Offering more evidence that the US economic recovery is losing steam, a closely watched gauge of future business activity has fallen for the second consecutive month. "
"Two bombs explode in Spain","TWO bombs exploded today in two coastal towns in northwestern Spain, after a tip-off by a caller claiming to represent the Basque separatist organisation ETA, an Interior Ministry spokesman said."
"England humble Windies","ONCE the tailenders of world cricket, England thumped the West Indies by 10 wickets at the Oval to complete a 4-0 whitewash yesterday and are now snapping at Australia #39;s heels for world dominance."
"Lourdes needs manna from heaven","The Catholic shrine of Lourdes yesterday opened a special bank account and appealed for donations from the faithful after it emerged that last weekend #39;s visit by the Pope had left it with a 1.2m (812,000) deficit. "
"News: Droughts Like 1930s Dust Bowl May Have Been Unexceptional in Prehistoric Times, New Study Suggests","Events like the great Dust Bowl of the 1930s, immortalized in ""The Grapes of Wrath"" and remembered as a transforming event for millions of Americans, were regular parts of much-earlier cycles of droughts followed by recoveries in the region, according to new studies by a multi-institutional research team led by Duke University. (Duke University press release)"
"Army, in Shift, Will Pay Halliburton","The Army reversed a decision to withhold payment on 15 percent of future payments to the Halliburton Company on its contracts in Iraq and Kuwait."
"Parmalat sues ex-auditors Deloitte, Grant Thornton","MILAN, Aug 18 (Reuters) - Parmalat sued its former auditors Deloitte  amp; Touche and Grant Thornton on Wednesday, broadening a legal battle to claw back billions of euros from ex-allies the food group says helped drive it into ..."
"Sox and bonds","There are games in which players renew their vows as teammates, and last night's 8-4 victory over the Toronto Blue Jays was one of them. It may not have been as clear as it was in the Yankee-Red Sox brawl game back in late July, which produced an obvious bond."
"Companies Approve New High-Capacity Disc Format (Reuters)","Reuters - A group of consumer electronics\makers said on Wednesday they approved the format for a new\generation of discs that can store five times the data of DVDs\at the same cost -- enough to put a full season of ""The\Sopranos"" on one disc."
"Cassini Finds Two New Saturnian Moons","Jet Propulsion Lab -- With eyes sharper than any that have peered at Saturn before, the Cassini spacecraft has uncovered two moons, which may be the smallest bodies so far seen around the ringed planet.     The moons are approximately 3 kilometers (2 miles) and 4 kilometers (2.5 miles) across -- smaller than the city of Boulder, Colorado..."
"Church Says Girl's Communion Not Valid","BRIELLE, N.J. - An 8-year-old girl who suffers from a rare digestive disorder and cannot eat wheat has had her first Holy Communion declared invalid because the wafer contained no wheat, violating Roman Catholic doctrine..."
"Columnists: The Panacea of Information Security","Step away from all the vendor hype. The one device that will always be the best tool for information security is a competent security professional."
"Many engineers lack a four-year degree","The news comes as some observers warn that the United States needs to focus more on training scientists and engineers."
"The Annual Perseid Meteor Shower","The annual Perseid meteor shower is coming, and forecasters say it could be unusually good. Like bugs streaking down the side window of a moving car, colorful Perseid Earthgrazers could put on a pleasing show after sunset this week."
"Cold Winters Slow Northeast Hemlock Pest (AP)","AP - New England's bitterly cold winters may be hard on people, but they have been even harder on an Asian insect that's threatening to destroy hemlocks, one of the signature trees of the region's forests."
"American Hamm Claims Men's Gymnastics All-Round Crown"," ATHENS (Reuters) - Paul Hamm became the first American man  to claim the Olympic gymnastics men's all-round gold medal on  Wednesday."
"HP Faces New Realities in a 64-Bit World (Ziff Davis)","Ziff Davis - The company this week will unveil more programs and technologies designed to ease users of its high-end servers onto its Integrity line, which uses Intel's 64-bit Itanium processor."
"Study: Global Warming Could Change Calif. (AP)","AP - Global warming could cause dramatically hotter summers and a depleted snow pack in California, leading to a sharp increase in heat-related deaths and jeopardizing the water supply, according to a study released Monday."
"New bird survives hungry Filipinos","Manila - A new species of flightless bird has been discovered living on a tiny island in the northern Philippines where the inhabitants formerly ate them, scientists and birdwatchers said on Tuesday. "
"Google #39;s Auction Loosens Wall Street #39;s Grip on High-Priced IPOs","Aug. 20 (Bloomberg) -- Google Inc. #39;s share sale has put Wall Street on notice: The old way of doing business may be ending. "
"Google to Pay Yahoo to Settle Patent Dispute"," SEATTLE (Reuters) - Google Inc. &lt;GOOG.O&gt; on Monday again  boosted the number of shares it plans to sell in its initial  public offering, saying it will issue 2.7 million shares to  Yahoo Inc. &lt;YHOO.O&gt; to settle a lawsuit over technology used to  display ads."
"U.S. Arrests Two in Hamas Financing Case"," WASHINGTON (Reuters) - U.S. officials have arrested two men  whom they accuse of funneling money to the Palestinian militant  group Hamas for the past 15 years, the Justice Department said  on Friday."
"Leading Indicators, Jobless Claims Dip","NEW YORK - A closely watched measure of future economic activity fell in July for the second consecutive month, reinforcing evidence that the nation's financial recovery is slackening.    The Conference Board said Thursday its Composite Index of Leading Economic Indicators dropped by 0.3 percent in July to 116.0, following a revised decline of 0.1 percent in June..."
"Senior Hamas leader wounded","An explosion tore through the home of a senior Hamas leader in Gaza yesterday, killing at least five people and wounding him and about a dozen other Palestinians, medics said. "
"UAL Wins OK for Exclusivity Extension (Reuters)","Reuters - A U.S. bankruptcy court judge on Friday\approved a 30-day exclusivity extension for United Airlines,\giving the carrier another month to file its own reorganization\plan without competing plans from creditors."
"Eolas patent on Web plug-in technology rejected","The controversial Eolas Technologies patent looks like it is about to be rescinded by the US Patent Office. The office has confirmed that it has rejected all of the 10 patent claims that it re-examined. "
"Chicago White Sox Team Report - August 20","(Sports Network) - The Chicago White Sox were handed an 8-4 setback by the Detroit Tigers on Thursday. Bobby Higginson homered twice to lead Detroit. "
"Space-age sport ","GPS is invading recreational sports. Under clear skies, those signals beaming to earth from satellites can find you on a hilly running trail, in a kayak on the ocean, or on a green fairway where you're trying to fade a 230-yard drive into the wind."
"Stocks Jump as Oil Retreats from High"," NEW YORK (Reuters) - U.S. stocks jumped higher on Friday,  as investor worry about high fuel costs crimping consumer  spending and hurting company profits eased after crude oil  prices fell from their peak."
"Nikkei Ends Down, Oil Worries Weigh","TOKYO (Reuters) - Tokyo stocks ended slightly lower on Friday as worries about record-high oil prices took the edge off investors #39; appetite for recently battered technology issues such as Shin-Etsu Chemical Co. Ltd. "
"Australia Considers Stockpiling Crude Oil, Australian Reports","Aug. 21 (Bloomberg) -- Australia #39;s government is considering stockpiling crude oil or refined petroleum products to protect the country from disruption to oil imports, the Australian reported. "
"Firewall Protection Without the Conflicts",". I understand that Microsoft #39;s Service Pack 2 for Windows XP, a new update, includes improved firewall protection. I currently use Norton Personal Firewall; will any incompatibility result when both firewalls are installed, and is one ..."
"New Jersey Nets Team Report - December 7","(Sports Network) - The New Jersey Nets try for their third consecutive win this evening when they head to Cleveland to face LeBron James and the Cavaliers at Gund Arena."
"Pau Edges Yao in Clash of the Giants"," ATHENS (Reuters) - Spain's Pau Gasol got the better of  China's Yao Ming in Olympic basketball's own clash of the  giants Sunday."
"Airport workers strike BA pay deal","More than 10,000 British Airways staff will be balloted by their unions this week over a last-ditch pay deal that has lifted the threat of bank holiday travel chaos at Heathrow."
"More Web Shopping Is What's in Store","The retail sector overall may be reporting a sluggish start to the season, but holiday shoppers are scooping up tech goods at a brisk pace -- and they're scouring the Web for bargains more than ever. &lt;FONT face=""verdana,MS Sans Serif,arial,helvetica"" size=""-2"" color=""#666666""&gt;&lt;B&gt;-washingtonpost.com&lt;/B&gt;&lt;/FONT&gt;"
"Green flexes muscles vs. Braves","Shawn Green hit a grand slam in the first inning and a solo homer in the third to lead the Dodgers to a 7-4 victory Saturday against the Atlanta Braves "
"Indonesia #39;s Megawati unveils grand coalition","JAKARTA, Aug 19 (Reuters) - Indonesian President Megawati Sukarnoputri, fighting to win a fresh term, formally unveiled on Thursday a coalition of parties seeking to ensure she stays in power for the next five years. "
"Clouds dash Perseids show","The annual Perseid meteor shower could provide a ""spectacular"" show, despite a disappointing start."
"Falconio suspect to stand trial","An Australian court has ordered lorry driver Bradley John Murdoch to stand trial over the murder of British backpacker Peter Falconio, who has been missing for three years. "
"Scientist Advocates for Embryonic Stem Cell Research","By KATHARINE WEBSTER     MANCHESTER, N.H. (AP) -- A Nobel laureate in medicine says the Bush administration's limits on funding for embryonic stem cell research have stopped the clock on American scientists' efforts to develop treatments for a host of chronic, debilitating diseases..."
"McDonald #39;s tests MasterCard PayPass","NEW YORK (CNN/Money) - McDonald #39;s Corp. announced Wednesday it would launch later this year a new  quot;contactless quot; payment option called MasterCard PayPass, which lets customers simply wave or tap the card to complete a quick transaction. "
