"Title","Text"
"Oil at \$47, Economic Impact Seen as Muted","LONDON (Reuters) - Oil prices surged to a new high above \$47 a barrel on Wednesday on evidence that energy costs are not substantially slowing the economic growth that fuels oil demand. "
"Greeks deny failed drug test reports","ATHENS (Reuters) - Greek Olympics officials say they are unaware of any team member failing a drugs test after media reports that the International Olympic Committee had found a Greek competitor had taken banned substances. "
"NY Atty General Spitzer to Run for Gov."," NEW YORK (Reuters) - New York Attorney General Eliot  Spitzer will announce on Tuesday he will run for governor of  the state in 2006, a spokeswoman said."
"Giant waves hurling boulders inland from British coasts: scientists","Massive waves created by violent storms off Britain and Ireland are ripping off chunks of cliff and hurling them inland over distances scientists did not think possible. "
"Illinois Helps Residents Import Drugs (Reuters)","Reuters - Illinois residents will soon gain\access to lower-cost prescription drugs from Canada, the United\Kingdom and Ireland, sidestepping U.S. regulators' objections\to imported drugs, Gov. Rod Blagojevich said on Tuesday."
"Portugal Suffers Humiliating Athens Exit in Soccer"," ATHENS (Reuters) - Portugal were bundled out of the men's  soccer tournament at the Athens Olympics on Wednesday after a  humiliating 4-2 defeat by Costa Rica."
"Air Canada Stock Plunges on Review"," MONTREAL (Reuters) - Shares of Air Canada  &lt;A HREF=""http://www.investor.reuters.com/FullQuote.aspx?ticker=AC.TO target=/stocks/quickinfo/fullquote""&gt;AC.TO&lt;/A&gt; fell by  more than half on Wednesday, after the Toronto Stock Exchange  said it was reviewing the company's stock to determine if it  meets listing requirements."
"Malaysia #39;s Sea Turtles Are in Trouble","KUALA LUMPUR, Malaysia - Several species of sea turtles in Malaysia could vanish in a few years, largely due to illegal poaching of the creatures and their eggs, scientists warned on Wednesday. "
"Football: Liverpool sign Nunez","Liverpool boss Rafael Benitez seals the signing of Antonio Nunez from Real Madrid."
"Cox speed boost leaves some members behind","Not all of the cable company's broadband subscribers got a recent hike in bandwidth."
"Lindows Postpones IPO","Its legal battles over, the software vendor will focus on sales until the market ripens."
"Volunteer Links Anti-Kerry Flier to GOP (AP)","AP - A volunteer for John Kerry said Friday he picked up a flier in Bush-Cheney headquarters in Gainesville, Fla., promoting Swift Boat Veterans for Truth, a group the Bush campaign has insisted for weeks it has no connection to."
"On deck: Marlins (60-60) at Padres (65-56), 7:05 tonight","The Skinny: Beckett is facing the Padres for the first time in San Diego. In two career starts in Florida, Beckett is 2-0 against the Padres with a 1.93 ERA."
"'E-Junk' Recycling Still in Its Infancy (AP)","AP - When Office Depot, Inc. stores ran an electronics recycling drive last summer that accepted everything from cell phones to televisions, some stores were overwhelmed by the amount of e-trash they received."
"Despite Setbacks, Stahl Maintains Healthy Dose of Optimism","At 23, pitcher Richard Stahl knows there's still time to impress the Baltimore Orioles' front office. He just needs to stay on the mound long enough."
"Storage Services Market Heading To  #36;30 Billion (TechWeb)","TechWeb - The growth comes as more vendors offer more software to offset the plunge in storage hardware prices."
"Pentagon Backs Off Halliburton","The Pentagon backed off its threat to withold its monthly payment of about \$60 million a month from a Halliburton subsidiary, which provides services for troops."
"Delta Plans Job Cuts, Eyes Restructure"," CHICAGO (Reuters) - Delta Air Lines Inc., the number three  U.S. carrier, plans more job cuts as it struggles to avoid  bankruptcy, Chief Executive Gerald Grinstein said in a memo to  employees on Wednesday."
"More Web Shopping Is What #39;s in Store","The retail sector overall may be reporting a sluggish start to the season, but holiday shoppers are scooping up iPods, DVDs, digital cameras and other tech goods at a brisk pace -- and they "
"Hungary #39;s ruling Socialist Party dumps PM","BUDAPEST, Aug. 19 (Xinhuanet) -- Hungary #39;s ruling Socialist Party said Thursday that it accepted Prime Minister Peter Medgyessy #39;s resignation and has named a candidate for the post. "
"British Airways strike averted after agreement reached","A planned strike by British Airways(BA) workers on the August Bank Holiday has been called off after a pay settlement was reached between employers and BA staff, Sky TV reported Saturday."
"'Potential Development' in Peterson Case","REDWOOD CITY, Calif. - The judge in Scott Peterson's murder trial dismissed the jurors for the day Wednesday, saying, ""There's been a potential development in this case.""   Judge Alfred A..."
"Riot in Salvadoran jail leaves 20 dead, 30 injured","MEXICO CITY, Aug. 18 (Xinhuanet) -- A bloody riot Wednesday in the La Esperanza Jail, in Mariona, in the outskirts of San Salvador, left a toll of at least 20 dead and another 30 injured. "
"Court Rejects Movie, Music Makers #39; Piracy Claims","LOS ANGELES (Reuters) - A federal appeals court on Thursday delivered a stinging blow to the anti-piracy efforts of major movie studios and music companies, ruling that several online file-sharing software companies are not liable for ..."
"LoJack buys Canadian tracking company","LoJack Corp., which makes devices for recovering stolen cars, agreed to buy Boomerang Tracking Inc. for about \$48 million to expand into Canada. LoJack will pay about \$4.32 a share in cash or a combination of cash and stock for the Montreal maker of stolen vehicle recovery equipment, LoJack said. Westwood-based LoJack also gets Boomerang's cash balance of \$12 million. ..."
"General Growth Properties to acquire Rouse for \$12.6 bn","NEW YORK, August 20 (New Ratings)  General Growth Properties Inc (GGP.NYS), the second-largest shopping mall operator in the US, has agreed to buy Rouse Company (RSE), in a cash and debt assumptions deal worth about \$12.6 billion. "
"An Elusive Peace in Najaf","The standoff is driven by Moqtada Sadr's political ambitions. But how good is his poker game?"
"Expedition to Peru Finds Five New Sites (AP)","AP - An American-led expedition discovered five new districts in what its leader described as an ancient jungle metropolis on the slopes of the Peruvian Andes."
"Stocks Rise on Drop in Consumer Prices","A drop in consumer prices and a decline in crude oil futures Tuesday allowed investors to put aside worries about inflation, at least for the short term, and they sent stocks modestly higher. "
"Withdrawal for Greek sprinters","Two of Greece's most famous athletes and their coach made their first public appearance here yesterday only to withdraw from the Olympic Games rather than face a panel charged with looking into a possible doping violation."
"Google Slashes IPO, SEC OK Expected Today"," NEW YORK/SAN FRANCISCO (Reuters) - Google Inc. slashed the  size of its initial public offering nearly in half to less than  \$2 billion on Wednesday, splashing cold water on what has been  touted as the hottest Internet IPO in years."
"News: TRMM Sees Rain from Hurricanes Fall Around the World","Since rain and freshwater flooding are the number one causes of death from hurricanes in the United States over the last 30 years, better understanding of these storms is vital for insuring public safety."
"CA acquires PestPatrol","Over the past year, spyware has become an increasing problem. Every time that you visit a web site, you must run the gauntlet of a variety of pop-up adverts, any of which can be programmed to place spyware on your computer. "
"American fouls out","OLYMPIA, Greece - When this whole Olympic thing started, the winner of its single event, a 210-yard sprint, would have his name used to identify the Games rather than the year. For instance, 776 BC was the Coroibos Games because ..."
"Teen Is First Black National USTA Champion (AP)","AP - Scoville Jenkins, a 17-year-old from Atlanta, became the first black to win the 18s singles championship of the U.S. Tennis Association Boys Nationals."
"Cherry-Picking Growth (Forbes.com)","Forbes.com - Rural hospitals, car insurers and furniture stores aren't exactly the first businesses that come to mind when talking about growth stocks, but fund manager Richard Aster Jr. picks through such sleepy industries to find growing companies that others have ignored."
"Greece Soul Searches, Phelps Nears Record"," ATHENS (Reuters) - Greece, an ancient nation, searched its  soul over a new doping scandal on Saturday while Michael  Phelps, a fresh-faced American teenager, prepared to enter the  Olympic record books without having to swim a stroke. The  Olympics started its eighth day with 32 gold medals up for  grabs in what has been dubbed Super Saturday."
"FCC mobile spam rule doesn't cover some SMS","A rule prohibiting mobile-phone spam adopted by the U.S. Federal Communications Commission (FCC) earlier this month doesn't prohibit phone-to-phone text messaging, but FCC officials believe the new rule, combined with a 13-year-old law, should protect U.S. mobile phone customers against unsolicited commercial e-mail."
"Germany Looking at Citigroup Bond Trading"," BERLIN (Reuters) - Germany's financial watchdog said on  Thursday it was looking into recent trading by U.S. financial  services group Citigroup &lt;A HREF=""http://www.investor.reuters.com/FullQuote.aspx?ticker=C.N target=/stocks/quickinfo/fullquote""&gt;C.N&lt;/A&gt; in European government bond and  derivative markets, but had not started a formal probe."
"Bengals brace for old teammate Dillon","FOXBORO, Mass.  New England Patriots running back Corey Dillon darted up the middle, bounced off one tackler, then made it a point to crash into two more defenders. It hardly mattered to Dillon that this training camp session ..."
"Oil Price Comes Close to \$50 but Then It Stages a Retreat","il prices climbed nearer to \$50 a barrel yesterday before retreating, as traders reacted to reports on the conflict in Iraq, concerned that growing unrest might interrupt crude oil exports. "
"Greek weightlifter tests positive","ATHENS (Reuters) - Greece looks set to lose the first medal it won at the Athens Olympics after bronze-winning weightlifter Leonidas Sampanis failed a drugs test. "
"Colts WR Walters Breaks Left Arm Vs. Jets (AP)","AP - Indianapolis Colts wide receiver Troy Walters broke his left arm on the first series of Saturday night's preseason game against the New York Jets."
"Animating for the Super Bowl","Against an impossible deadline, a small team at Sony Cinematics Solutions Group created a two-minute animated promo to prove that a tech-savvy group could do dazzling broadcast work. Aug 13"
"More Home stories:","Great Britain #39;s gold medal tally now stands at five after Leslie Law was handed the individual three day eventing title - in a courtroom."
"Schroder adopts Russian orphan","Three-year-old Victoria, from St Petersburg, has been living at the Schroders #39; family home in Hanover in northern Germany for several weeks. "
"Four Indonesian political parties form National Coalition","JAKARTA Aug 19 - Four Indonesian political parties - Golkar, Indonesian Democratic Party-Struggle (PDIP), United Development Party (PPP) and Peace and Prosperity Party (PDS) - declared a national coalition on Thursday in their bid to form a good ..."
"Google Raises \$1.67 Bln in Cut-Price IPO"," NEW YORK/SAN FRANCISCO (Reuters) - Google Inc., the most  popular Internet search engine, raised \$1.67 billion on  Wednesday in its long-awaited IPO after slashing the price and  size of an offer beset by missteps and poor market conditions."
"IPO thrusts Google into new direction","There #39;s the multibillion-dollar auction that snubs Wall Street #39;s powerful investment banks. There #39;s the IPO manifesto with the pledge to change the world."
"Four Dead After Attack on Homeless Man (AP)","AP - Four homeless men were bludgeoned to death and six were in critical condition on Friday following early morning attacks by unknown assailants in downtown streets of Sao Paulo, a police spokesman said."
"Rwanda Troops Airlifted to Start AU Mission in Darfur (Reuters)","Reuters - Rwandan troops were airlifted on Sunday\to Sudan's Darfur as the first foreign force there, mandated to\protect observers monitoring a cease-fire between the Sudanese\government and rebels in the troubled western region."
"U.S. Men Qualify for Final in Shot Put (AP)","AP - Two U.S. men advanced to the final of the shot put Wednesday, hoping to make even more history at the ancient site that gave birth to the Olympics 2,780 years ago."
"Tokyo Stocks Close Up for Third Day"," TOKYO (Reuters) - Japanese shares rose for a third straight  day on Thursday, advancing over one percent as a rally on Wall  Street encouraged buying of technology issues such as Toshiba  Corp. and Shin-Etsu Chemical"
"Apple Recalls Batteries In G4 Laptops","Apple Computer Inc. on Thursday recalled the batteries used in 15-inch PowerBook G4 computers, due to an internal short that can cause the batteries to overheat and pose a fire hazard to consumers. "
"AccuRev touts software configuration management approach","AccuRev on Monday will release an upgrade to its SCM (software configuration management) package that the company argues offers a superior alternative to file-based SCM systems."
"Mass. Republicans Eye Kerry's Senate Seat (AP)","AP - Massachusetts Republicans, while supportive of President Bush's re-election, are mindful of the opportunity created should John Kerry beat him in November's election: the state's first Senate vacancy in two decades and a chance to break the Democratic monopoly on its 12-member delegation in Congress."
"Wal-Mart Tries to Shine Its Image by Supporting Public Broadcasting","Wal-Mart, stung by criticism of its business tactics, is working to improve its image by supporting public broadcasting."
"United: Pension end is likely","United Airlines said termination and replacement of all of its pension plans  quot;likely will be required quot; for the company to exit bankruptcy and attract financing. "
"Google Sells Shares in IPO for \$85 After Cutting Price of Stock","Aug. 19 (Bloomberg) -- Google Inc., the most-used Internet search engine, sold shares at \$85 each in its initial public offering, the bottom of the range the company had suggested the stock would fetch in the biggest auction-style IPO. "
"Bank of America signs in","They served up a giant Bank of America sheet cake, festooned the bank branch with balloons, and dispatched smiling greeters to welcome customers in upstate New York yesterday, as the first FleetBoston Financial Corp. branches formally switched to Bank of America."
"Lebanese shun mobile phones for a day in protest at high costs (AFP)","AFP - Lebanese mobile phone users were urged to leave their portable telephones at home or switched off in protest at what is considered one of the costliest services in the world."
"Sanders excites Ravens","The Baltimore Ravens are excited about the prospect of having Deion Sanders come out of retirement and be a part of their defensive backfield. The question now is: Will he take them up on their offer?"
"Full Disclosure Ordered","The NFL told its coaches Monday that they must be more specific in reporting injuries to players, saying the current wording of the policy ""invites action that runs counter to our intent."""
"Unobstructed Views: Olympic-sized fools","For all their troubles, the Olympic Games remain the greatest unifying force in the world. Every four years, they draw a diverse international audience, bridging cultural gaps, transcending ethnic divisions, and uniting us all in a single, harmonious ..."
"UN airlifts food to Darfur town","The UN drops food into remote communities in Sudan's troubled Darfur region that are cut off by rain."
"Olympics : Japan #39;s Kitajima completes breaststroke double","ATHENS : Kosuke Kitajima completed a sweep of Olympic breaststroke gold on Wednesday, capturing the 200m title in a Games record ahead of Hungarian teenager Daniel Gyurta. "
"Agassi Opens With A Win In Washington","No. 1 seed Andre Agassi overcame a sluggish start to the first set to eventually beat compatriot Paul Goldstein in straight sets at the Legg Mason Classic in Washington. "
"Williams  #39;Hungary #39; for success","British heavyweight hope Danny Williams believes the key to beating WBC champion Vitali Klitschko and becoming the heavyweight champion of the world in Las Vegas on December 11 is his hunger and desire to succeed."
"Nikkei Falls Over 1 Pct on Oil Worries (Reuters)","Reuters - Tokyo's Nikkei fell more than one percent\by mid-morning on Monday as investors stepped up selling of\exporters such as Toyota Motor Corp. amid growing fears of the\impact of surging oil prices on the global economy."
"Alison Williamson takes bronze to hit her Olympic target after 12 years","Inspired by the magnificent surroundings of the Panathinaiko stadium and assisted by a gust of wind and a police siren, the British archer Alison Williamson ended her 12-year quest for an Olympic medal at the fourth attempt when she won bronze in the ..."
"Yankees Blow Lead but Beat Twins 13-10 (AP)","AP - Gary Sheffield homered twice and keyed a four-run rally in the ninth inning Thursday night, sending the New York Yankees to a seesaw, 13-10 win over the Minnesota Twins."
"Cleric Who Died in Pakistan Custody  #39;Tortured #39;","ISLAMABAD (Reuters) - An Afghan Islamic cleric who died in custody in Pakistan on Wednesday had signs of torture on his body, an intelligence official said. "
"World marks go in the pool","ATHENS - The Australian women and American men ended the swimming competition at the Athens 2004 Olympics Games in style Saturday, both breaking world records in the 4x100 meter medley relays."
"Eagles Beat Ravens 26-17 but Lose Runner (AP)","AP - Terrell Owens caught Donovan McNabb's long pass in stride, raced into the end zone, put his hands on his hips, stared at the crowd and nodded his head."
"UK challenge of India outsourcing","The High Street bank could be facing legal action over the transfer sensitive customer data overseas to call centres in India."
"Major League Baseball to Create Channel","OS ANGELES, Aug. 20 (Reuters) - Major League Baseball has approved the creation of a national cable television channel devoted to the sport, but regular-season games may be confined to the bench for the network #39;s first year, a top league ..."
"3 Directors at Cox to Study Bid by Parent to Take Unit Private","ox Communications, the nation #39;s third-largest cable television operator, has formed a committee to consider the \$7.9 billion bid by its parent, Cox Enterprises, to take the company private. "
"Demetra Proud of Husband #39;s Achievements","Matthew Pinsent got the nod to carry on moments after winning his fourth Olympic gold medal from the person who matters most, his wife Demetra."
"GB badminton duo make final","Nathan Robertson and Gail Emms reach the final of the badminton mixed doubles."
"McDonald's serves up film blitz","McDonald's takes out ads in the UK to say a film about its food is ""slick"" and ""well-made"" - but unrealistic."
"Google makes market debut","IN A debut vaguely reminiscent of the dot.com boom, shares of internet search giant Google surged in their first day of public trading. "
"Redskins cut former starter Ohalete","ASHBURN, Va. (AP) -- He was demoted to third string a couple weeks ago, didn #39;t do exactly what the coaches wanted and was coming off a bad game. Ifeanyi Ohalete knew what was coming next. "
"Last laugh","Oh, those wacky Red Sox. Nothing like a little levity to take the edge off a playoff race. That #39;s why Terry Francona #39;s merry pranksters last night let Manny Ramirez lead the charge out of the dugout in the ..."
"Olympia oozes Games history","OLYMPIA, GREECE -- Great players will walk upon a historic stage today at the Ancient Olympia Stadium. "
"Basketball: China #39;s Yao Takes Anger Out on New Zealand","ATHENS (Reuters) - An angry Yao Ming took his frustrations out on New Zealand at the Olympic men #39;s basketball tournament on Tuesday, pouring in 39 points as China beat the Kiwis 69-62. "
"Vogue Adds Online Shopping Feature","While Vogue's September issue is still offering its famously dramatic images of 6-foot beauties clad in high fashion, the publication is adding an extra element that is a bit more utilitarian - online shopping."
"Australia #39;s Pacific Hydro FY04 Net A\$40.7M, Up 39","CANBERRA (Dow Jones)--Renewable energy generator Pacific Hydro Ltd. (PHY.AU) reported Wednesday a 39 jump in net profit, including a one-time tax benefit, to A\$40.7 million in the fiscal year ended June 30, up from A\$29.3 million in the previous year. "
"Mars Hills, Crater Yield Evidence of Flowing Water (Reuters)","Reuters - The hills of Mars yielded more\tantalizing clues about how water shaped the Red Planet in\tests by NASA's robotic geologist, Spirit, while its twin,\Opportunity, observed the deep crater it climbed into two\months ago, scientists said on Wednesday."
"Google IPO Paper Not Declared Effective (Reuters)","Reuters - The U.S. Securities and Exchange\Commission did not declare effective Google Inc.'s registration\statement for its multibillion-dollar initial public offering\by the close of the agency's business day on Tuesday, an SEC\official said."
"CompUSA Agrees to Sell Gateway PCs (PC World)","PC World - Desktop systems will be available in 226 stores across the U.S."
"A new generation of US sprinters take their marks","As track and field begins at the Games, it is up to athletes like Lauryn Williams to set right a sport seared by scandal. "
"Suspected Militants Kidnap Iraqi Officer-Jazeera (Reuters)","Reuters - Suspected militants have kidnapped an\Iraqi intelligence officer in response to the fighting in the\holy city of Najaf, Al Jazeera television reported on Tuesday."
"Demonstrators protest benefit cuts in Berlin","Thousands of demonstrators brought protests against benefit cuts to the German capital yesterday, but the Government insisted it would make no further change to measures it sees as key to a more competitive economy. "
"Iraqi captors to  #39;free US journalist #39;","The captors of an French-American journalist being held in Iraq have announced he will be released soon. "
"Progress Is Made Battling Strep Germ","By LINDSEY TANNER     CHICAGO (AP) -- Scientists say they are making headway in developing a vaccine against a common strep germ, the cause of millions of sore throats as well as a deadly but uncommon flesh-eating disease.    A test of an experimental vaccine in just 28 people prompted an immune response with no serious side effects, but it's still not known if the shot would keep people from catching the strep germ..."
"Internet calls add foreign accent (USATODAY.com)","USATODAY.com - In the digital age, the next best thing to being there might be this: a French phone number."
"IMlogic unveils IM, P2P threat-detection network","DECEMBER 07, 2004 (COMPUTERWORLD) - IMlogic Inc. and several partners today unveiled a new instant messaging  quot;threat center quot; clearinghouse aimed at fighting IM viruses, malicious software code and spam before they occur."
"Applied Materials Takes on Metron","Applied Materials (Quote, Chart) said it filled a major gap in its services portfolio with its acquisition of Metron Technology (Quote, Chart). "
"Global LCD Oversupply to Peak in Q3"," SEOUL (Reuters) - A global oversupply of large-sized liquid  crystal displays (LCDs) is forecast to peak in the third  quarter of this year, but it will balance out by the fourth  quarter, a U.S.-based research firm said on Friday."
"LifePoint to Buy Rival for \$1 Bln","LifePoint Hospitals has agreed to acquire rival Province Healthcare for \$1.125 billion in cash and stock to broaden its geographic reach."
"U.S.: Al-Sadr Withdrawal Would Be Welcome (AP)","AP - The Bush administration reacted suspiciously Wednesday to reports that the radical Shiite cleric Muqtada al-Sadr had accepted a peace plan to end fighting in Najaf."
"Strategies for a Sideways Market"," WASHINGTON (Reuters) - The bulls and the bears are in this  together, scratching their heads and wondering what's going to  happen next."
"Do-it-yourself phishing kits found on the internet, reveals Sophos","Sophos experts have discovered that do-it-yourself phishing kits are being made available for download free of charge from the internet. "
"Webb Ousted in Prelim","Alan Webb is outmaneuvered and outrun as he failed to make it out of the preliminary round in the 1,500 meters."
"Speed Up Saddam's Trial, Allawi Tells Court (Reuters)","Reuters - Interim Prime Minister Iyad Allawi\urged an Iraqi court Monday to speed up proceedings against\toppled leader Saddam Hussein and his close aides."
"Hewitt Thunders to Final","Lleyton Hewitt advanced to the finals of the Legg Mason Tennis Classic with a 6-3, 6-4 win over Robby Ginepri on Saturday."
"Small investors scared off by exercise in stock democracy","This was supposed to be the people's IPO, an exercise in shareholder democracy that would serve as a model for other companies seeking to go public without the suffocating embrace of Wall Street."
"Pentagon turns to Linux for high-end battlefield simulations","As part of its technology update program, the Defense Department has turned to two 256-processor Linux Networx Evolocity cluster supercomputers to improve complex computerized battlefield simulations."
