"Title","Text"
"Parmalat to sue auditors","PARMALAT, the bankrupt Italian food company, is suing outside auditors Grant Thornton and Deloitte  amp; Touche, seeking 5.5 billion in damages. "
"Europe and US in aircraft aid row","The European Commission and President George Bush are in a war of words over subsidies given to aircraft makers Airbus and Boeing."
"Patterson makes it an all-around sweep for US","Two decades later, it #39;s time to make room for Carly Patterson as America #39;s next reigning champion of Olympic women #39;s gymnastics. "
"Kerry: Bush Lets Groups Do 'Dirty Work'","BOSTON - Sen. John Kerry accused President Bush on Thursday of relying on front groups to challenge his record of valor in Vietnam, asserting, ""He wants them to do his dirty work.""   Fighting back, Kerry said if Bush wants to ""have a debate about our service in Vietnam, here is my answer: 'Bring it on.'"" Bush served stateside in the Texas Air National Guard during the war..."
"Bush pressing case for  #39;ownership society #39;","Amid signs that the economy is cooling, President Bush is showcasing initiatives for a second term under the banner of an  quot;ownership society quot; in hopes of bolstering his economic stewardship credentials."
"The Art of Controlled Aggression"," ATHENS (Reuters) - The word judo means ""Way of Gentleness""  in Japanese."
"Vandy #39;s List gets in final of Amateur","MAMARONECK, NY - Luke List has already made it further than he ever thought, so why stop now? That #39;s the attitude of the 19-year-old Vanderbilt sophomore, who continued his string of US Amateur upsets with "
"Google rises in market debut after bumpy IPO","NEW YORK/SEATTLE, Aug 19 (Reuters) - Google Inc. (GOOG.O: Quote, Profile, Research) shares made their long-awaited stock market debut on Thursday, rising sharply to \$100 after an initial public offering marked by ..."
"Winning is Greek to US: Outlasts h","ATHENS - Larry Brown found out some things about his team last night. Among them was that Allen Iverson apparently shoots better with a fractured right thumb than he does with two healthy paws. "
"ICJ ruling on Israeli fences may lead to sanctions: Attorney General","JERUSALEM, Aug. 19 (Xinhuanet) -- Israeli Attorney General Menachem Mazuz said Thursday that the Hague ruling by the International Court of Justice (ICJ) on Israeli security fences could lead to sanctions against the country, local newspaper Ha #39;aretz ..."
"Nortel accounting faces probe","Canadian officials are opening a criminal investigation into accounting at Nortel Networks Corp. Shares in the telecom equipment maker edged lower yesterday."
"Darfur humanitarian crisis easing, UN says","KHARTOUM, Sudan  While violence remains a major concern, the humanitarian crisis in the Darfur region is easing and large-scale deaths from malnutrition and disease are likely to be averted as international assistance pours in, UN ..."
"IBM seeks dismissal of breach of contract claims in SCO case","IBM has filed court documents seeking a dismissal of a second major component of the lawsuit filed against it last year by Unix supplier SCO. "
"At least someone #39;s winning in this war","News Item:  quot;The US Army has threatened to partially withhold payments to Halliburton due to allegations of overcharges for food, shelter and services. quot; ..."
"Hollywood awaits Termite from Texas and Iraqi fly","What an inspirational story: former world title contender becomes used car salesman in Texas, becomes rattlesnake killer, becomes pest exterminator in Baghdad, becomes boxing coach of Iraq and self-proclaimed  quot;saviour quot; of that troubled nation. It is ..."
"Late surge lifts US past Aussies","The Mason's Union membership cards should be arriving any day now, but while they wait for them to be distributed, the United States men's basketball team was able to concoct a winning formula by relying on their unquestioned athletic superiority over the Australians yesterday."
"NL Wrap: Green Homers Lift Los Angeles Past Atlanta"," NEW YORK (Reuters) - Shawn Green hit two home runs,  including a grand slam, as Los Angeles defeated the Atlanta  Braves 7-4 in a battle of National League division leaders at  Dodger Stadium on Saturday."
"Treasuries, Oil Up, Inflation in Check"," NEW YORK (Reuters) - Treasury debt prices rallied on  Tuesday, dragging yields to four-month lows as July inflation  figures proved subdued and soaring oil prices pointed to slower  U.S. consumer spending down the line."
"Briefly: Gateway says, hold on to your hard drive","roundup Plus: Kinko's debuts Web-based print options...Majoras takes charge of FTC...Business Objects to bundle IBM tools."
"Mass. still a no-go for Geic","Geico Corp., the nation's fifth-largest auto insurer, started selling policies in New Jersey yesterday for the first time in 28 years, leaving Massachusetts as the lone state where the company won't do business."
"Falcons' Kerney Sprains Knee in Practice (AP)","AP - Atlanta Falcons defensive end Patrick Kerney sprained his right knee in practice on Sunday when a lineman rolled on his leg."
"Report: Tougher testing on the way for MLB","NEW YORK (Ticker) - With the dark cloud of steroids continuing to hover over baseball, it appears a tougher drug-testing policy may be in effect by spring training."
"U.S. Wins Rowing Gold","The American men's elite eight crew ends a four-decade drought in rowing gold medals Sunday, pulling out to a big lead and fending off a late charge by the Netherlands."
"Cisco flaw opens networks to attacks","Cisco has warned in a security advisory that some networks with its routers could be vulnerable to denial-of-service attacks. "
"U.S. Men End 40-Year Rowing Drought"," ATHENS (Reuters) - The United States stormed to their first  Olympic men's eights title in 40 years on Sunday."
"Remy International will sell its Williams Technologies unit","Anderson (Star report) -- Remy International Inc. said Wednesday it has agreed to sell its US transmission remanufacturing operation, Williams Technologies Inc., to Caterpillar Inc. "
"ING to Withdraw \$5 Bln from Janus Funds","NEW YORK (Reuters) - ING US Financial Services said late on Tuesday it will withdraw about \$5 billion from Janus Capital Group Inc. funds by year-end. "
"Microsoft Issues 2nd SQL Server 2005 Public Beta","On Friday, Microsoft issued its second Community Technology Preview (CTP) release of SQL Server 2005, while providing public testers with a new beta release as well, SQL Server 2005 Express Manager, a new, free database management tool."
"Mutual Funds Opt to Liquidate","Some of the nations more than 8,000 mutual funds are shutting their doors, as their manag- ers confront a lackluster stock market, great- er regulatory scrutiny and higher costs."
"Michael Phelps Wins Second Gold Medal (AP)","AP - Michael Phelps, denied in his bid to win seven gold medals, picked up his second victory of the Athens Games by winning the 200-meter butterfly Tuesday night in Olympic-record time. Phelps fell just short of his own world record, holding off Takashi Yamamoto to win in 1 minute, 54.01 seconds. The hard-charging Japanese swimmer took silver in 1:54.56, while Great Britain's Stephen Parry won bronze in 1:55.22."
"PM clarifies Downer #39;s ANZUS comments","MAXINE MCKEW: The Prime Minister has gently steered his Government back onto the official diplomatic line about Australia #39;s military obligations to America. "
"7 More Managers Fired Over Nortel Accounting","The company announced the firings on Thursday along with a restructuring plan that included layoffs of about 3,500 employees."
"Sharon #39;s Gaza plan hinges on vote","Israeli Prime Minister Ariel Sharon has lost a key vote which would have seen the dovish Labour Party join the government coalition and salvage his Gaza disengagement plan. "
"Germany #39;s Chancellor Schroder and his wife adopt Russian girl","Germany #39;s Chancellor Gerhard Schroder and his wife Doris have adopted a three-year-old Russian girl who has been living with them for over a fortnight, Germany #39;s mass circulation Bild newspaper revealed yesterday. "
"Paes-Bhupathi overcome injury scare and Federer","Athens, Aug 19. (PTI):Leander Paes and Mahesh Bhupathi overcame an injury scare and world number one singles #39; player Roger Federer of Switzerland to advance to the quarterfinals of the men #39;s doubles tennis event at the Olympic Games here on Wednesday. "
"Borders Profits Rise, Raises Outlook"," NEW YORK (Reuters) - Borders Group Inc. &lt;A HREF=""http://www.investor.reuters.com/FullQuote.aspx?ticker=BGP.N target=/stocks/quickinfo/fullquote""&gt;BGP.N&lt;/A&gt;, the No. 2  U.S. bookseller, on Tuesday said quarterly earnings rose,  beating estimates by the company and Wall Street, largely  because of stronger-than-expected book sales."
"New media battle for Bafta awards","The BBC leads the nominations for the Bafta Interactive Awards, including one for the Radio Times website."
"Seahawks Defeat Packers 21-3 in Preseason (AP)","AP - Fourth-string quarterback Seneca Wallace led Seattle on two touchdown drives and the Seahawks took advantage of Tim Couch's dismal debut for Green Bay in a 21-3 exhibition victory over the Packers on Monday night."
"Alcoa closing Ohio plant, cutting 140 jobs","Alcoa Inc. will close an automotive components factory in Ohio and lay off its staff in a bid to cut excess capacity, the Pittsburgh-based company said Tuesday. "
"Home Depot Sees 2Q Profit Jump","The Home Depot Inc. reported a nearly 19 percent jump in second-quarter profit on record sales as it benefited from strong performance in stores open at least a year. It also raised its earnings outlook for the year."
"Competition probe would see Santander turn its back on Abbey","Banco Santander would walk away from its 8.2bn offer for Abbey National, the mortgage bank, if a rival bid from one or more UK banks led to a lengthy investigation by the competition authorities."
"Basketball: Americans Behind Again at Halftime"," ATHENS (Reuters) - The U.S. men's basketball team were once  again in danger of defeat at the Olympic tournament on  Thursday, trailing Australia 51-47 at the end of the first  half."
"Cubs face music after suffering heartbreak","Usually after a heartbreaking loss, the losing team #39;s locker room is as quiet as a tomb. Cubs closer LaTroy Hawkins, who allowed two runs in the bottom of the ninth and suffered the "
"UK Terrorist Suspects Have Case Sent to Old Bailey (Update2)","Aug. 18 (Bloomberg) -- The case against eight men charged with conspiracy to commit murder and carry out terrorist attacks was referred to the Old Bailey, London #39;s central criminal court. "
"Kerry admits to soft spot for Oscar winner Theron (AFP)","AFP - Democratic presidential contender John Kerry has a soft spot for South African actress Charlize Theron but is adamant that second wife Teresa Heinz-Kerry changed his life, he has told GQ magazine."
"Stocks Open Near Flat as Oil Near Record"," NEW YORK (Reuters) - U.S. stocks opened little changed on  Monday as crude prices remain near their record highs, but  early reports of victory for the Venezuelan president in a  referendum on his rule eased fears about the country's oil  exports."
"Google Up in Market Debut After Bumpy IPO"," NEW YORK/SEATTLE (Reuters) - Google Inc. shares made their  long-awaited stock market debut on Thursday, rising sharply to  \$100 after an initial public offering marked by missteps and  lackluster market conditions."
"Students Win \$100,000 in National Team Science Competition","Lucie Guo, motivated by the death of her grandfather in China before she was born, spent two summers doing research in a Duke University laboratory."
"White House Touts High-End Computing In R amp;D Budgets","It #39;s instructing executive-branch heads to give priority to supercomputing and cyberinfrastructure research and development in their fiscal 2006 budgets. "
"Even in win, nasty vibes","ATHENS -- As you saw yesterday, they #39;re fighting back now. Not with the world, but with themselves. When you #39;ve been humiliated at your own game, ridiculed and laughed at back home and can #39;t intimidate Australia anymore, someone #39;s bound to mope. "
"Rumsfeld warning for Iraq's Sadr","The Iraq crisis and differences over Nato loom over the US Defence Secretary's meeting with his Russian counterpart."
"Gartner: 'Steer away' from cheap Windows XP","That's the research firm's verdict on Microsoft's stripped-down Starter Edition for developing countries."
"Gloom amid the boom","BANGALORE - The success of India #39;s high-tech and outsourcing industry was built on Bangalore but the southern city where the boom began has now become a victim of its own success. "
"Chinese boom pays off for BHP","BHP Billiton has delivered the biggest profit ever achieved by an Australian company - a \$US3.38billion (\$4.73billion) whopper, up 78 per cent on last year. "
"SEC Rules Expand Disclosure","Companies must disclose more information about their business deals and financial obligations starting Monday, when new Securities and Exchange Commission rules take effect."
"Boeing Sees EU Agreeing to End Launch Aid"," WASHINGTON (Reuters) - A top Boeing Co. official said on  Friday he was optimistic the European Union would agree to end  government aid to develop new aircraft, which has helped its  chief rival Airbus grab more than half of the civil aircraft  market."
"Greek weightlifter stripped of bronze","Athens, Greece (Sports Network) - Greek weightlifter Leonidas Sampanis on Sunday was stripped of the bronze medal he won last week and banished from the Athens Games for failing an antidoping test."
"August Mid-Atlantic Factory Output Slows (Reuters)","Reuters - Output at U.S. Mid-Atlantic factories\slowed in August as new orders dropped sharply, suggesting\recent weakness in the economy is likely to persist into coming\months."
"Violence in blockaded Kathmandu as Nepal agrees to meet Maoists halfway (AFP)","AFP - Maoist rebels who have cut off Kathmandu for three days attacked security forces and bombed buildings inside the Nepalese capital, as the government partially agreed to guerrilla demands for lifting the blockade."
"Haitian Rebel Leader Appears for Trial (AP)","AP - Jury selection began Monday for a Haitian paramilitary leader convicted in absentia of killing a businessman and ordering a massacre in the early 1990s but is facing the charges again after returning to lead a revolt against President Jean-Bertrand Aristide."
"Google Rises in Market Debut"," NEW YORK/SEATTLE (Reuters) - Shares of Google Inc. &lt;A HREF=""http://www.investor.reuters.com/FullQuote.aspx?ticker=GOOG.O target=/stocks/quickinfo/fullquote""&gt;GOOG.O&lt;/A&gt;  made their long-awaited stock market debut on Thursday, rising  more than 20 percent to over \$100 after an initial public  offering marked by missteps and lackluster market conditions."
"Najaf stand-off has beginnings in earlier US failures in Fallujah","The battle of Najaf, in which Iraq #39;s fledgling government is being held to ransom by the occupation of Shia Islam #39;s holiest site, can be traced to American political and military failures in recent months. "
"Phelps on way to great 8","That #39;s the goal now, with two events remaining in what already has been a grueling Olympic schedule for this 19-year-old US swimming star. "
"All-American girl","That was then and this is now. That was there and this is here. So which is a bigger moment? Mary Lou Retton's  quot;No-Fault Vault quot; that produced America's first Olympic all-around gold medal in women's gymnastics 20 years ago in Los Angeles? Or Carly Patterson's  quot;Dream Beam quot; here last night that clinched the second?"
"Wily Devers snares spot in semifinals","ATHENS -- The US women #39;s trio of 100-meter sprinters, including five-time Olympian Gail Devers, all raced into the semifinals with strong, controlled performances yesterday in the debut of the track and ..."
"File Sharing Companies Ruled Not Liable","A federal appeals court yesterday ruled that two developers of file-sharing programs are not legally liable for the copyrighted content their users swap online. "
"Dampier headed to Mavericks?","Longtime Warriors center Erick Dampier could be on the verge of finding a new home, 2 1/2 months after becoming a free agent. "
"End of the line for HP's Alpha processor","Hewlett-Packard Co. will release the final processor upgrade for its AlphaServer line of Unix servers on Monday."
"Wall Street Set to Open Down (Reuters)","Reuters - U.S. shares were expected to open lower\on Wednesday after crude oil pushed to a fresh high overnight,\while Web search engine Google Inc. dented sentiment as it\slashed the price range on its initial public offering.\In a statement posted on its IPO Web site, Google said it had\cut the range on its IPO to  #36;85- #36;95 per share from  #36;108- #36;135\previously, a 26 percent reduction at the mid-point of the\range."
"Moore Reaches U.S. Amateur Semifinals (AP)","AP - Ryan Moore keeps rolling along in the U.S. Amateur, moving into the semifinals with a 3 and 2 victory over Jason Hartwick on Friday at Winged Foot Golf Club."
"Sudan army voices opposition to upgrading of African Union mission (AFP)","AFP - The Sudanese army expressed opposition to the upgrading of an African Union protection mission newly arrived in the wartorn western region of Darfur into a full-blown peacekeeping force."
"The youth vote: Hard to tell how it will turn out (USATODAY.com)","USATODAY.com - The youth vote, perhaps the most elusive quarry in U.S. politics, is being Rocked, Smacked Down, Rapped and otherwise goosed by everyone from blinged-out rappers to Harvard professors to the League of Women Voters."
"Germans 'lose event gold'","Germany is reportedly stripped of its three-day event team gold medal after a joint appeal was upheld."
"Ex-Enron CEO Seeks Separate Trial"," HOUSTON (Reuters) - Lawyers for former Enron Corp.  &lt;A HREF=""http://www.investor.reuters.com/FullQuote.aspx?ticker=ENRNQ.PK target=/stocks/quickinfo/fullquote""&gt;ENRNQ.PK&lt;/A&gt; chief executive Jeffrey Skilling on Friday asked a  federal court to separate his trial from his former boss Ken  Lay's on charges linked to the downfall of the energy company."
"Azevedo shot does trick","Tony Azevedo whizzed a last-second shot past Croatian goalkeeper Frano Vican to give the American water polo team a 7-6 victory in its tournament opener yesterday."
"Militants, Israeli Troops Battle in Gaza","A period of relative calm in the Gaza Strip was broken by a nearly hour-long battle between Palestinian militants and Israeli troops that left at least one Israeli soldier and one militant dead."
"Say slams teammates #39; relay effort","ATHENS -- The meltdown continues in the pool for Canada #39;s swimmers. Only this time, it #39;s talk and not just times that are creating heat. Rick Say, who has posted Canada #39;s best individual showing in the pool with a sixth-place finish in the highly ..."
"Were the judges by any chance French?","Kosuke Kitajima #39;s technique may get a sharper eye from officials today in the 200-meter breaststroke race. "
"Google, Set for Offering, Cuts Share Price by About a Quarter","Google cut its price range to between \$85 and \$95 a share, down from \$108 to \$135, valuing the company at as much as \$25.8 billion."
"Oil Falls on Reduced Concern About Venezuelan, Russian Supply","Aug. 17 (Bloomberg) -- Crude oil futures fell for a second day after a Russian state railway official said shipments of Yukos Oil Co. oil would continue and Venezuelan President Hugo Chavez won a recall vote. "
"Capital professor lands lead role with UK Athletics","EDINBURGH University professor Dave Collins was today appointed as the new performance director of UK Athletics. The ex-Royal Marine, who has worked with competitors across a range of sports in the Capital "
"AL Wrap: Redman Helps Athletics Maintain AL West Lead"," NEW YORK (Reuters) - Mark Redman pitched eight strong  innings as the Oakland Athletics clung on to first place in the  American League West with a 3-1 road win over the Baltimore  Orioles on Monday."
"Bowa's status with Phillies is shaky","Larry Bowa's time as Philadelphia Phillies' manager could be running out. General manager Ed Wade declined to give Bowa an endorsement before last night's game against the Houston Astros, saying only,  quot;He's the manager. quot; Told that comment can be interpreted many ways, Wade replied:  quot;Interpret it any way you want. quot; The fiery Bowa has come under scrutiny because the injury-plagued ..."
"Google prepares to wrap up share auction (AFP)","AFP - Google Inc prepared to wrap up an extraordinary share auction, meaning a final price in the multi-billion-dollar listing will be announced within days."
"Delta seeks permission to buy back certain bonds","NEW YORK, Aug 18 (Reuters) - Delta Air Lines (DAL.N: Quote, Profile, Research) said on Wednesday it was asking permission to buy back debt from about 10 percent of its bondholders, in a first step toward the struggling company #39;s efforts to restructure its ..."
"Ghana election draws strong turnout","Snaking lines of hundreds of voters built up at balloting places across Ghana on Tuesday, as the first sub-Saharan country to gain independence voted for president."
"Paes-Bhupathi overcome Federer-Allegro (Reuters)","Reuters - World number one Roger Federer's top target for the year -- an Olympic tennis gold medal -- was taken away from him in a ""terrible day"" on Tuesday."
"U.S. Struggles to Win Muslim Hearts, Minds","The Bush administration is facing growing criticism that it has failed to move aggressively enough in the war of ideas against al Qaeda and other Islamic extremist groups over the three years since the 9/11 attacks."
"Eight Terror Suspects Face British Charges","LONDON - Two of the suspects allegedly had surveillance plans of the Prudential Building in Newark, N.J., mentioned in the Aug. 1 U.S..."
"Sadr Militia in Contacts to Hand Over Najaf Shrine","NAJAF, Iraq (Reuters) - Top aides of radical cleric Moqtada al-Sadr prepared to hand over control of a holy shrine at the center of a crisis in Najaf on Friday to representatives of Iraq #39;s top ayatollah, a Sadr spokesman said. "
"New U.N. Official Assumes Kosovo Control (AP)","AP - The new U.N. administrator for Kosovo took control Sunday of the Serbian province, which has remained deeply divided along ethnic lines since the end of a 1999 war."
"Oil Tops \$49 On Renewed Iraq Violence","LONDON (Reuters) - Global oil prices raced to fresh highs on Friday, carrying US crude close to \$49.16 a barrel up 46 cents, driven by escalating violence in Iraq and unabated demand growth from China and India. "
"Matfield turns the Aussie tide","A rugby nation lifted its head once more last night. The surprise was that it was South Africa, not Australia or New Zealand, who emerged into the light clutching the coveted Tri-Nations trophy."
"Geogia woman wins medal in fencing","ATHENS - The United States won its first fencing medals in 20 years Tuesday, a bronze by an Atlanta-area competitor and a gold by Mariel Zagunis in the saber competition. "
"Beach Volleyball: Australia in with a Shout"," ATHENS (Reuters) - To prepare for the Olympics, Kerri  Pottharst practiced serving with her team mate screaming in her  ear."
"Pope Struggles Through Mass at Lourdes","LOURDES, France - A sick man among the sick, Pope John Paul II struggled through Sunday Mass at a French shrine that draws desperate people seeking miracle cures. The 84-year-old pontiff gasped, trembled and asked aides for help during the 2 1/2 hour service in sizzling heat..."
"Sprinters #39; Withdrawals Lift Cloud Over Games","ATHENS (Reuters) - Greece #39;s top two sprinters pulled out of the Olympics on Wednesday after inflicting six days of embarrassment on their country over a hide-and-seek contest with anti-doping enforcers. "
"2 More Turkish Men Taken Hostage in Iraq (AP)","AP - Armed assailants attacked a convoy of Turkish trucks delivering supplies to U.S. forces in Iraq and took two Turkish drivers hostage, their company said Monday."
"Space Science Pioneer Van Allen Questions Human Spaceflight (SPACE.com)","SPACE.com - A leading space scientist has called to question the validity of human spaceflight, suggesting that sending astronauts outward from Earth is outdated, too costly, and the science returned is trivial."
"Palestinian Prisoners Launch Hunger Strike","JERUSALEM - More than a thousand Palestinian prisoners went on a hunger strike to press for better conditions, but Israel responded by tightening inmate restrictions, and a Cabinet minister said he wouldn't care if they starved to death.    About 1,600 prisoners struck on Sunday..."
"UK welcomes corncrake's comeback","The rare corncrake is starting to return to England, but several other birds are still in serious trouble."
"Jackson's Lavish Lifestyle Put on Display","SANTA MARIA, Calif. - The elegant life of Michael Jackson was put on display in a courtroom Thursday when defense attorneys showed videotaped scenes from last year's raid on the pop star's lavish Neverland estate..."
"Two Wounded in Second Bomb Blast in Nepal Capital","KATHMANDU (Reuters) - Two people were wounded after a second bomb exploded in Nepal #39;s capital on Friday, the third day of a blockade of the commercial center called by Maoist rebels. "
"Iraq Cleric Agrees to End Uprising, Fighting Rages On (Reuters)","Reuters - A radical Iraqi cleric leading a\Shi'ite uprising agreed on Wednesday to disarm his militia and\leave one of the country's holiest Islamic shrines after\warnings of an onslaught by government forces."
